,id,date,time,user_id,username,name,tweet,language,replies_count,retweets_count,likes_count,keywords
1275,1561999454299123712,2022-08-23,04:51:05,1004229021222068224,bolarin981,Bola Rin,Cambodian prime minister Hun Sen advised Cambodian information minister Khieu Kanharith to terminate a license of any media company if found using inappropriate language. #Cambodia #CPP #Peace #Development #Stability #Democracy #ThankPeace #PeaceMan  https://t.co/3OrMdo60dL,en,0,0,0,"['CPP', 'cambodia']"
1276,1561999073645043714,2022-08-23,04:49:34,1004235330109595654,seanseyha87,Sean Seyha,Cambodian prime minister Hun Sen pledged to spend his entire life safeguarding the kingdom and the people #Cambodia #CPP #Peace #Development #Stability #Democracy #ThankPeace #PeaceMan  https://t.co/JbgeSj9ZTM,en,0,0,0,"['CPP', 'cambodia']"
1277,1561998354519068672,2022-08-23,04:46:42,1004235330109595654,seanseyha87,Sean Seyha,Cambodian prime minister Hun Sen reacted to analysts who criticized the recent visit of Hun Manet to Viet Nam. #Cambodia #CPP #Peace #Development #Stability #Democracy #ThankPeace #PeaceMan  https://t.co/H5fCnBuu8I,en,0,0,0,"['CPP', 'cambodia']"
1278,1561998093398454274,2022-08-23,04:45:40,1004235330109595654,seanseyha87,Sean Seyha,Cambodian prime minister Hun Sen said the ruling power will still be in the hands of the Cambodian People’s Party (CPP) even if he is no longer in power. #Cambodia #CPP #Peace #Development #Stability #Democracy #ThankPeace #PeaceMan  https://t.co/lVcYYY70EU,en,0,0,0,"['CPP', 'cambodia']"
1279,1561998034535587841,2022-08-23,04:45:26,1004235330109595654,seanseyha87,Sean Seyha,"Cambodian prime minister Hun Sen said the establishment of the Department of Vietnamese Studies at the Royal University of Phnom Penh (RUPP) would give benefits to people, not the loss. #Cambodia #CPP #Peace #Development #Stability #Democracy #ThankPeace #PeaceMan  https://t.co/yDTKk7UA0j",en,0,0,0,"['CPP', 'cambodia']"
1280,1561997693379297280,2022-08-23,04:44:05,1000990622637961216,engvanda34,Eng Vanda,Cambodian prime minister Hun Sen advised Cambodian information minister Khieu Kanharith to terminate a license of any media company if found using inappropriate language. #Cambodia #CPP #Peace #Development #Stability #Democracy #ThankPeace #PeaceMan  https://t.co/qixtzZURnL,en,0,0,0,"['CPP', 'cambodia']"
1281,1561997622352949248,2022-08-23,04:43:48,1000990622637961216,engvanda34,Eng Vanda,Cambodian prime minister Hun Sen pledged to spend his entire life safeguarding the kingdom and the people #Cambodia #CPP #Peace #Development #Stability #Democracy #ThankPeace #PeaceMan  https://t.co/EjhNffdbOm,en,0,0,0,"['CPP', 'cambodia']"
1282,1561997572671434752,2022-08-23,04:43:36,1000990622637961216,engvanda34,Eng Vanda,Cambodian prime minister Hun Sen reacted to analysts who criticized the recent visit of Hun Manet to Viet Nam. #Cambodia #CPP #Peace #Development #Stability #Democracy #ThankPeace #PeaceMan  https://t.co/qUEW5Y2dG1,en,0,0,0,"['CPP', 'cambodia']"
1283,1561997524034273285,2022-08-23,04:43:24,1000990622637961216,engvanda34,Eng Vanda,"Cambodian prime minister Hun Sen said that Cambodia’s future candidate for prime minister does not need a support for any foreign country, but the support from Cambodian People’s Party (CPP). #Cambodia #CPP #Peace #Development #Stability #Democracy #ThankPeace #PeaceMan  https://t.co/t7PO1CU8LY",en,0,0,0,"['CPP', 'cambodia']"
1284,1561997299357990912,2022-08-23,04:42:31,1000990622637961216,engvanda34,Eng Vanda,Cambodian prime minister Hun Sen said he could not befriend some people who publicly declared to destroy Hun’s family. #Cambodia #CPP #Peace #Development #Stability #Democracy #ThankPeace #PeaceMan  https://t.co/9UTzqHlF8i,en,0,0,0,"['CPP', 'cambodia']"
1285,1561997244706226176,2022-08-23,04:42:18,1000990622637961216,engvanda34,Eng Vanda,"Cambodian prime minister Hun Sen said the establishment of the Department of Vietnamese Studies at the Royal University of Phnom Penh (RUPP) would give benefits to people, not the loss. #Cambodia #CPP #Peace #Development #Stability #Democracy #ThankPeace #PeaceMan  https://t.co/wNbmvHb661",en,0,0,0,"['CPP', 'cambodia']"
1286,1561996948819054592,2022-08-23,04:41:07,1000444782907293696,keotola123,Keo Tola,"Cambodian prime minister Hun Sen said the establishment of the Department of Vietnamese Studies at the Royal University of Phnom Penh (RUPP) would give benefits to people, not the loss. #Cambodia #CPP #Peace #Development #Stability #Democracy #ThankPeace #PeaceMan  https://t.co/v8LyVMdmx0",en,0,0,0,"['CPP', 'cambodia']"
1287,1561996890086199296,2022-08-23,04:40:53,1000444782907293696,keotola123,Keo Tola,Cambodian prime minister Hun Sen said he could not befriend some people who publicly declared to destroy Hun’s family. #Cambodia #CPP #Peace #Development #Stability #Democracy #ThankPeace #PeaceMan  https://t.co/82ZS577GK6,en,0,0,0,"['CPP', 'cambodia']"
1288,1561996853025337344,2022-08-23,04:40:44,1000444782907293696,keotola123,Keo Tola,Cambodian prime minister Hun Sen said the ruling power will still be in the hands of the Cambodian People’s Party (CPP) even if he is no longer in power. #Cambodia #CPP #Peace #Development #Stability #Democracy #ThankPeace #PeaceMan  https://t.co/RKhbWJKh6q,en,0,0,0,"['CPP', 'cambodia']"
1289,1561982265680621569,2022-08-23,03:42:47,1000444782907293696,keotola123,Keo Tola,"Cambodian prime minister Hun Sen said that Cambodia’s future candidate for prime minister does not need a support for any foreign country, but the support from Cambodian People’s Party (CPP). #Cambodia #CPP #Peace #Development #Stability #Democracy #ThankPeace #PeaceMan  https://t.co/VGlRw1hN1s",en,0,0,0,"['CPP', 'cambodia']"
1290,1561980701389766656,2022-08-23,03:36:34,1000444782907293696,keotola123,Keo Tola,Cambodian prime minister Hun Sen reacted to analysts who criticized the recent visit of Hun Manet to Viet Nam. #Cambodia #CPP #Peace #Development #Stability #Democracy #ThankPeace #PeaceMan  https://t.co/7ZRKK7YUoU,en,0,0,0,"['CPP', 'cambodia']"
1291,1561979667233767425,2022-08-23,03:32:27,1004229021222068224,bolarin981,Bola Rin,"Cambodian prime minister Hun Sen said the establishment of the Department of Vietnamese Studies at the Royal University of Phnom Penh (RUPP) would give benefits to people, not the loss. #Cambodia #CPP #Peace #Development #Stability #Democracy #ThankPeace #PeaceMan  https://t.co/mdgUihTcL6",en,0,0,0,"['CPP', 'cambodia']"
1292,1561979345979461633,2022-08-23,03:31:10,1004235330109595654,seanseyha87,Sean Seyha,Cambodian prime minister Hun Sen said he could not befriend some people who publicly declared to destroy Hun’s family. #Cambodia #CPP #Peace #Development #Stability #Democracy #ThankPeace #PeaceMan  https://t.co/Bh6gW3SnrD,en,0,0,0,"['CPP', 'cambodia']"
1293,1561978744142987264,2022-08-23,03:28:47,1000990622637961216,engvanda34,Eng Vanda,Cambodian prime minister Hun Sen said the ruling power will still be in the hands of the Cambodian People’s Party (CPP) even if he is no longer in power. #Cambodia #CPP #Peace #Development #Stability #Democracy #ThankPeace #PeaceMan  https://t.co/VHziFTyJiw,en,0,0,0,"['CPP', 'cambodia']"
1294,1561977582270423040,2022-08-23,03:24:10,1000444782907293696,keotola123,Keo Tola,Cambodian prime minister Hun Sen pledged to spend his entire life safeguarding the kingdom and the people #Cambodia #CPP #Peace #Development #Stability #Democracy #ThankPeace #PeaceMan  https://t.co/pqluOqVrBb,en,0,0,0,"['CPP', 'cambodia']"
1295,1561976698337660930,2022-08-23,03:20:39,1000444782907293696,keotola123,Keo Tola,Cambodian prime minister Hun Sen advised Cambodian information minister Khieu Kanharith to terminate a license of any media company if found using inappropriate language. #Cambodia #CPP #Peace #Development #Stability #Democracy #ThankPeace #PeaceMan  https://t.co/8yg6FWST1Z,en,0,0,0,"['CPP', 'cambodia']"
1296,1561953929344204800,2022-08-23,01:50:11,2579852005,khmertimes,Khmer Times,Six members who left the Cambodia National Love Party (CNLP) and joined the Cambodian People’s Party (CPP) have been appointed as senior government officials by King Norodom Sihamoni.  https://t.co/Zk9PtABu5a,en,0,1,1,"['CPP', 'cambodia']"
1297,1561934363725819905,2022-08-23,00:32:26,78552712,comfrel,COMFREL,Six former senior leaders of the Cambodia National Love Party have been given senior positions in the Ministry of Posts and Telecommunications after they joined the ruling Cambodian People’s Party (CPP).  https://t.co/ohWS4jhGjs,en,0,0,0,"['CPP', 'cambodia']"
1298,1561639767523180545,2022-08-22,05:01:49,479297376,lowriejohn,𝐉𝐨𝐡𝐧 𝐋𝐨𝐰𝐫𝐢𝐞,"@ZyiteGadgets #Cambodia It is the only sensible decision along with not boycotting. The truth is #CPP is not the natural choice of a simple majority, hence the ruthless artificial ways it manipulates processes.  https://t.co/bodBVh7BJa",en,0,0,0,"['CPP', 'cambodia']"
1299,1560645476915073025,2022-08-19,11:10:51,144615713,reaproy,Phil Robertson,@noansereiboth The interlocking directorate of CPP political control continues to the new generation of sons &amp; daughters of ruling elites in #Cambodia. Sad but fully expected.,en,0,0,3,"['CPP', 'cambodia']"
1300,1559459400531603456,2022-08-16,04:37:49,78552712,comfrel,COMFREL,"While hailing Japan’s crucial role in Cambodia’s peace-building process, the ruling Cambodian People’s Party (CPP) spokesman claimed that of the countries in Mekong region, Cambodia is one of the countries that upholds democracy.  https://t.co/R2bzgORM3w",en,0,0,1,"['CPP', 'cambodia']"
1301,1559455902654136323,2022-08-16,04:23:55,394407875,aunchhengpor,Chhengpor Aun,"After #Taiwan, US Congressional Delegation led by @SenMarkey, @RepGaramendi, @RepLowenthal, @DonBeyerVA &amp; @RepAmata landed in #Cambodia Monday evening and met CPP Senators, MPs, and Minister at the National Assembly this morning. Officials said they discussed rights &amp; democracy.  https://t.co/U6iGO13jnw",en,3,3,13,"['CPP', 'cambodia']"
1302,1558898409750290435,2022-08-14,15:28:38,93112282,neeatsum,MëliØdās ✊💎🇵🇸🇨🇦🇷🇺🇰🇭🇯🇵,"@AJEnglish #Cambodia is trending - for once I want to hear something positive about my motherland, but sadly as long as #HunSen &amp; his Hanoi thugs - CPP is still in power, doesn't good can come from there! #HunSenMustGo @USEmbPhnomPenh @AusEmbPP @khmerican @SEA_GLOBE @PeacePalaceKH @PDChina",en,0,1,1,"['CPP', 'cambodia']"
1303,1558880508037267456,2022-08-14,14:17:30,93112282,neeatsum,MëliØdās ✊💎🇵🇸🇨🇦🇷🇺🇰🇭🇯🇵,"@Indochina_War These guys are criminals &amp; invaders, not saviours - let's make no mistake about it! They punished #Cambodia not once but twice by installing one of their own #HunSen &amp; thugs - CPP as a puppet regime! We will NEVER forgive or forget! 😡✊ @PDChina @PeacePalaceKH @SEA_GLOBE @ASEAN",en,5,0,0,"['CPP', 'cambodia']"
1304,1557935003606327296,2022-08-11,23:40:24,93112282,neeatsum,MëliØdās ✊💎🇵🇸🇨🇦🇷🇺🇰🇭🇯🇵,@phnompenhpost Here we go again! Saddam Hun Sen &amp; thugs are still the same shit! There is #NoDemocracy in #Cambodia as long the CPP aka Hanoi puppet regime still in power! They must be removed at all costs! @Diplomat_APAC @PDChina @SEA_GLOBE @USEmbPhnomPenh @Reaproy @SAdamsR2P @PeacePalaceKH,en,0,0,0,"['CPP', 'cambodia']"
1305,1557755407854084097,2022-08-11,11:46:45,394407875,aunchhengpor,Chhengpor Aun,"The rise of #CNRP, the need to embolden state capacity of control, and Chinese backing prompted #Cambodia #CPP government's immigration crackdown starting in 2015 that saw many in Vietnamese communities rendered illegal, writes Jing Jing Luo and Kheang Un.  https://t.co/PkpgHqNThY",en,3,6,9,"['CPP', 'cambodia']"
1306,1556743033151946752,2022-08-08,16:43:56,17595053,radiofreeasiakh,RFA Khmer/វិទ្យុអាស៊ីសេរី,#Candlelightparty and #NGOs reacted to #CPP for not sharing working office and uniforms for #CLP Commune Councils in #KampongThom... #RFAKhmer #Politics #Cambodia,en,1,0,0,"['CPP', 'cambodia']"
1307,1556216156486238209,2022-08-07,05:50:19,770151132698116096,ktseye_ebooks,KT's Eye,Cambodia yesterday began verifying the ballots for the CPP!,en,0,0,0,"['CPP', 'cambodia']"
1308,1555084518968930305,2022-08-04,02:53:36,117763433,shrimppastefan,SPF,@MechDara1 @USAIDCambodia @USAmbCambodia @iJmillz @OHCHR_Cambodia Wow... and just like that OUR IN-HOUSE CPP TRUTHERS ARE BORN. @jolleyma should be aware of the article.,en,0,0,1,"['CPP', 'cambodia']"
1309,1554761458029940737,2022-08-03,05:29:52,394407875,aunchhengpor,Chhengpor Aun,"Amid growing tensions in the #Taiwan Strait, #China FM Wang Yi is attending #Asean #AMM55 in Phnom Penh. This morning, he chronologically met HM King Sihamoni of #Cambodia, #CPP's designated future PM candidate Hun Maneth, and @PMHunSen.  https://t.co/PNAs90TlSJ",en,2,0,5,"['CPP', 'cambodia']"
1310,1553501018050072576,2022-07-30,18:01:20,1043392947704619009,saromprak,Sarom Prak,"@POTUS In Cambodia under a dictator &amp; military ruler Hun Sen,healthcare system is under zero cos they don't care.They care power only. Only democratic government led by CNRP can sort all the crisis in  https://t.co/DYhTYfD2Jj CPP out &amp; put democratic party in 2023,otherwise it's 2 late.",en,0,0,0,"['CPP', 'cambodia']"
1311,1552991293558915076,2022-07-29,08:15:52,1171722553380888576,vod_english,VOD English,"Confusion prevailed at the minor Cambodia National Love Party on Friday after a party statement dissolved the party and asked supporters to migrate to the ruling CPP, but a senior party leader called the statement fake.  https://t.co/0fr8RXy01u",en,0,1,3,"['CPP', 'cambodia']"
1312,1552911792690860032,2022-07-29,02:59:57,392593057,ouritthy,ou ritthy អ៊ូ រិទ្ធី,"Many #Camodia related political events, clear it at #Politikoffee! 👉ASEAN chair condemns Myanmar executions 👉Hiding dirty money in Australia 👉Cambodia Democracy and Human Rights Act 👉Constitutional changes 👉9th CPP's offspring, a new governor 👉Opposition party alliance.....",en,4,3,9,"['CPP', 'cambodia']"
1313,1552883205669150726,2022-07-29,01:06:22,1386373699,freshnewsasia,Fresh News,TOP NEWS: Cambodia National Love Party Announces Dissolution and Urges Members to Join CPP   https://t.co/lNRCChZGPO,en,0,0,0,"['CPP', 'cambodia']"
1314,1552875237728890880,2022-07-29,00:34:42,202102332,noansereiboth,Noan Sereiboth,"The Cambodia National Love Party, which was established by 2 former opposition members, announced its dissolution &amp; called on its members to join the CPP. The party said under right leadership of PM Hun Sen, Cambodia has peace, dev &amp; a prosperous future is a reason of dissolution",en,3,3,12,"['CPP', 'cambodia']"
1315,1552865653010227201,2022-07-28,23:56:37,779757181,morysar,Sar Mory,"FUNCINPEC, a royalist political party in Cambodia and Khmer Unity Party, which is led by former senior officer of FUNCINPEC, released statements to endorse &amp; support the 10th amendment of the Cambodian constitution by the national assembly and all members of Parliament from CPP.  https://t.co/aI34XKeODN",en,0,1,6,"['CPP', 'cambodia']"
1316,1552148810209828865,2022-07-27,00:28:08,973449397,aseanmp,APHR,"The move also comes seven months after Hun Manet, Hun Sen’s oldest son, was elected as the “prime minister candidate of the future” by the CPP, thus paving the way for him to succeed his father at an unspecified point in the future. #Cambodia  https://t.co/tZQVon2cbf",en,1,0,0,"['CPP', 'cambodia']"
1317,1552127506651795456,2022-07-26,23:03:29,479297376,lowriejohn,𝐉𝐨𝐡𝐧 𝐋𝐨𝐰𝐫𝐢𝐞,@COMFREL This is another one of those incessant debates in #Cambodia that cannot be solved because no-one recognises nor respects a neutral referee.  The first party to contest official election results was of course #CPP in 1993.  https://t.co/dd8VfrB0nP,en,0,0,0,"['CPP', 'cambodia']"
1318,1552009216273047557,2022-07-26,15:13:26,1543981815563784196,ge0politics0,geopolitics,"""U.S. NGO promoting political participation has come under fire in Cambodia following allegations that it advised the opposition Cambodia National Rescue Party (CNRP) on how to beat the ruling Cambodian People’s Party (CPP)""  https://t.co/yFlCllGSuU",en,0,0,0,"['CPP', 'cambodia']"
1319,1551563123014135809,2022-07-25,09:40:49,17183476,photo_journ,John Le Fevre 🇦🇺 😷 🇹🇭🇰🇭,"A ruling-party parliamentarian, a CPP senator’s family member &amp; a business associate of the PM’s daughter R among the latest recipients of #Cambodia state-land transfers that have seen lakes, forests &amp; wildlife sanctuaries gifted to the country’s elite   https://t.co/2XE4l9AOE7",en,0,2,1,"['CPP', 'cambodia']"
1320,1551392227510845440,2022-07-24,22:21:45,1467872082356686850,lisallo77692930,Lisa Lloyd,#CPP's senator rejects draft sanction law of US. #Cambodia  https://t.co/YQKCv1Z08N…  @RadioFreeAsiaKH,en,0,0,0,"['CPP', 'cambodia']"
1321,1550840656158986241,2022-07-23,09:50:00,17595053,radiofreeasiakh,RFA Khmer/វិទ្យុអាស៊ីសេរី,#CPP's senator rejects draft sanction law of US. #Cambodia  https://t.co/LIGFwOCOgN @RadioFreeAsiaKH,en,0,0,4,"['CPP', 'cambodia']"
1322,1550787080472576003,2022-07-23,06:17:06,780254904828977152,anachemson,Andrew Nachemson,"The Cambodian Senate, where the CPP holds every single popularly ""elected"" seat, is somehow aghast at the suggestion that elections in Cambodia aren't fair",en,0,2,5,"['CPP', 'cambodia']"
1323,1549993825690652673,2022-07-21,01:45:00,1103749630096015360,cipeasiapacific,CIPE Asia Pacific,"🗳While the ruling Cambodian People's Party (CPP) won a majority of seats during the #Cambodia 2022 commune elections, the newly formed opposition party, Candlelight Party (CLP), took home 18.2% of the available councilor seats, a significant opposition achievement  https://t.co/agElryRXLY",en,0,0,0,"['CPP', 'cambodia']"
1324,1549970893254045697,2022-07-21,00:13:52,117763433,shrimppastefan,SPF,"@LowrieJohn @doyle_kevin @Sophiemcneill @4corners @jolleyma @Cambodia @KhmerTimes Good morning, some lengthy attack on Mary Ann Jolly (whose reporting I love) from the CPP's youth arm. I hope no local journalists/translators are harmed in the production.  https://t.co/juqGWB6ny7",en,2,0,3,"['CPP', 'cambodia']"
1325,1549732113682878465,2022-07-20,08:25:03,792338229408169984,pheaktraneth,Neth Pheaktra,"The protector: The onus is on #CPP , as the ruling government, to purge any move that can disrupt the #Cambodia #peace and stability - Khmer Times  https://t.co/lPXq402V9w",en,0,1,6,"['CPP', 'cambodia']"
1326,1549685692753903616,2022-07-20,05:20:35,2529026508,bunnavann7kh,Bunna Vann,"Co-founder of The Thinker Cambodia Mr. @RSokvy argued that though Hun Manet has significant support from Cambodian citizens and within the CPP, it is critical that he gains approval from the international community.    https://t.co/pAzBv6u24P via @east_asia_forum",en,0,0,1,"['CPP', 'cambodia']"
1327,1549201271617253377,2022-07-18,21:15:40,21856182,eurasiareview,Eurasia Review,"Cambodia: Hun Sen's Son Set For Electoral Success - Analysis  https://t.co/iNMzvf8WPi By Sokvy Rim*  The Cambodian People’s Party (CPP) achieved a landslide victory in the commune elections in June 2022, gaining 80 per cent of the 11,622 commune council positions. Yet there ...  https://t.co/kmkODCm27k",en,0,0,0,"['CPP', 'cambodia']"
1328,1549181655616835585,2022-07-18,19:57:43,17595053,radiofreeasiakh,RFA Khmer/វិទ្យុអាស៊ីសេរី,#CPP Extraordinary Central Committee Conference supports 10th amendment to constitution paving the way for power transfer to Hun Manet in post 2023 general #Election... #RFAKhmer #Politics #Cambodia,en,1,0,1,"['CPP', 'cambodia']"
1329,1549043981539057666,2022-07-18,10:50:39,770151132698116096,ktseye_ebooks,KT's Eye,Cambodia topped the latest victims to the progress of the CPP to provide insights on authentic Kh….,en,0,0,0,"['CPP', 'cambodia']"
1330,1547433183880556544,2022-07-14,00:09:55,78552712,comfrel,COMFREL,"The Cambodian Youth Party (CYP) has requested meeting with representatives of the National Election Committee (NEC) to discuss electoral reform in Cambodia, as the party claims it has identified irregularities in the election process.  https://t.co/dsJHg7bKET",en,0,2,0,"['irregularities', 'cambodia']"
1331,1547408540742160384,2022-07-13,22:32:00,16561457,radiofreeasia,Radio Free Asia,A senior official for Cambodia’s main opposition party accused of defamation for claiming there were irregularities in June 5 local elections said after testifying before the Phnom Penh Municipal Court on Tuesday that his trial is a waste of time.   https://t.co/80eUwtZ2Wv,en,0,2,3,"['irregularities', 'cambodia']"
1332,1547106299103567872,2022-07-13,02:31:00,19223233,anfrel,ANFREL,"""A senior official for #Cambodia’s main opposition party accused of defamation for claiming there were irregularities in the June 5 local commune #elections said his trial is a waste of time after testifying before the Phnom Penh Municipal Court.""   https://t.co/w1rQwy6Ule",en,0,1,1,"['irregularities', 'cambodia']"
1333,1539367556812881920,2022-06-21,18:00:00,90407341,southeastasiadc,CSIS Southeast Asia,"“As expected, Prime Minister Hun Sen’s Cambodian People’s Party (CPP) claimed a decisive victory in elections marked by voter intimidation and irregularities” writes  @charlesdunst in his recent spotlight on Cambodia. Read more here:  https://t.co/4vd1dTzVYi",en,0,1,1,"['irregularities', 'cambodia']"
1334,1537193232861233152,2022-06-15,18:00:01,90407341,southeastasiadc,CSIS Southeast Asia,"“As expected, Prime Minister Hun Sen’s Cambodian People’s Party (CPP) claimed a decisive victory in elections marked by voter intimidation and irregularities” writes  @charlesdunst in his recent spotlight on Cambodia. Read more here:  https://t.co/4vd1dTRwPQ",en,1,1,0,"['irregularities', 'cambodia']"
1335,1536621238562750464,2022-06-14,04:07:06,1070161941476237312,probonocambodia,Pro Bono & Advisory Law Group,The ruling party in #cambodia has finally lodged a complaint against a senior member of the opposition party - the Candlelight Party - over recent commune #elections irregularities.  https://t.co/XvLzH9Rqf1,en,0,1,0,"['irregularities', 'cambodia']"
1336,1536181815282745344,2022-06-12,23:01:00,19223233,anfrel,ANFREL,ANFREL member @COMFREL and other CSOs observed election irregularities during the voting and counting processes at the 2022 commune and sangkat council #elections in #Cambodia.   Read the preliminary summary report of their observation here:  https://t.co/6VqwYj7cNI,en,1,5,6,"['irregularities', 'cambodia']"
1337,1534415174454476800,2022-06-08,02:01:00,19223233,anfrel,ANFREL,"""Nationwide #elections for local councils were marred by fraud and irregularities, #Cambodia’s opposition Candlelight Party said Monday while ruling out a formal protest against what the ruling Cambodian People’s Party claimed was a sweeping victory.""   https://t.co/L1hEO9JNXm",en,0,0,1,"['irregularities', 'cambodia']"
1338,1534190391330734084,2022-06-07,11:07:47,347568180,voastevenson,Jim Stevenson,"Cambodia's opposition Candlelight Party said that local elections this weekend were marred by fraud and irregularities, but it ruled out a formal protest against what the ruling Cambodian People's Party claimed was a sweeping victory.   https://t.co/bPIB0j4coa @RadioFreeAsia",en,0,0,0,"['irregularities', 'cambodia']"
1339,1534068137590722561,2022-06-07,03:02:00,16561457,radiofreeasia,Radio Free Asia,"Cambodia’s opposition Candlelight Party said that local elections this weekend were marred by fraud and irregularities, but it ruled out a formal protest against what the ruling Cambodian People’s Party (CPP) claimed was a sweeping victory.   https://t.co/kMebmmSAy2",en,0,4,4,"['irregularities', 'cambodia']"
1340,1533982394566742016,2022-06-06,21:21:17,973449397,aseanmp,APHR,"Nationwide elections for local councils were marred by fraud and irregularities, Cambodia’s opposition Candlelight Party said Monday. #Cambodia  https://t.co/afePGS93Nt",en,1,1,2,"['irregularities', 'cambodia']"
1341,1533959066535358465,2022-06-06,19:48:35,1969051933,ultrascan419,Ultrascan 419,"Cambodia's Candlelight Party says commune election marred by widespread fraud: Nationwide elections for local councils were marred by fraud and irregularities, Cambodia's opposition Candlelight Party said Monday while ruling ...  https://t.co/pwioLMnAXd #phishing #fraud",en,0,0,0,"['irregularities', 'cambodia']"
1342,1533341548091707395,2022-06-05,02:54:47,902236875292786688,ktravouillon,Katrin Travouillon,"Human rights groups warn that Sunday's election could be fraught with irregularities. ""We are disturbed by the pattern of threats, intimidation and obstruction targeting opposition candidates"" Cambodia's communal elections: Hope for a new opposition party?  https://t.co/24ppotbuXs",en,1,3,11,"['irregularities', 'cambodia']"
1343,1502067236340920323,2022-03-10,18:41:50,2150659849,tutorcambodia,UK Tutoring Services,"In a letter dated March 7, department director Ly Meng San informed all heads of the town and district #education offices that the ban was based on complaints from students’ parents, who claimed that there were irregularities in #teaching in the province’s #schools. #Cambodia",en,0,0,2,"['irregularities', 'cambodia']"
1344,1500749512645697536,2022-03-07,03:25:41,1299757001740816391,midwestweather3,Midwest Weather,Cambodia: Strong winds damage more than 10 houses as weather irregularities continue via /r/weather  https://t.co/stebeGbbrP,en,0,0,0,"['irregularities', 'cambodia']"
1345,1500700104017297412,2022-03-07,00:09:21,1219407739,naturearticles,Nature Articles,Cambodia: Strong winds damage more than 10 houses as weather irregularities continue  https://t.co/OOEXwiTz4s,en,0,0,0,"['irregularities', 'cambodia']"
