,id,date,time,user_id,username,name,tweet,language,replies_count,retweets_count,likes_count,keywords
1842,1551027748080328704,2022-07-23,22:13:26,744840375492214786,realfakeliberal,Primordial,"@implausibleblog That's not corruption, this is corruption: Scott Morrison, as #auspol Immigration Minister shopped FIVE (5) refugees to Cambodia for A$55,000,000 @ $11,000,000 per head ... or so he said, we  never did see where the money finished up, nor learn who the middleman was.",en,0,1,1,"['corruption', 'cambodia']"
1843,1550985344832573440,2022-07-23,19:24:56,15075355,carbonfarmer,carbonfarmer,@PeacePalaceKH 1.  Human rights and the law? Utter and complete rubbish.   Your court in my case refused evidence of gross abuse of authority of the courts and officers provided by the Minister of Justice and Interior. Why? To do so would allow us to sue them all...  Fact #corruption #Cambodia,en,2,0,0,"['corruption', 'cambodia']"
1844,1550548734353805312,2022-07-22,14:30:00,21406834,senmarkey,Ed Markey,I am pleased @SFRC has passed my Cambodia Democracy and Human Rights Act to hold Cambodian officials accountable for corruption and abuse. I urge swift Senate and then House passage so we can sign this bill into law without delay.,en,4,5,14,"['corruption', 'cambodia']"
1845,1550467950167080962,2022-07-22,09:09:00,3283054495,mekongeye,Mekong Eye,#CAMBODIA: The government blames shortage of rangers for increasing number of forest crimes in Keo Seima and Sre Pok wildlife sanctuaries. But activists say corruption and lack of cooperation with locals are to blame.   https://t.co/DMOFi23FeM,en,0,1,1,"['corruption', 'cambodia']"
1846,1550244731250245633,2022-07-21,18:22:00,402618457,miketatarski,Michael Tatarski,"In the new Vietnam Weekly: sharing the best reporting on Cambodia's dark scam operations, and an update on the Viet A and Coast Guard corruption scandals.  https://t.co/PBYlhdh9Gl",en,2,2,14,"['corruption', 'cambodia']"
1847,1550203614789976065,2022-07-21,15:38:37,15075355,carbonfarmer,carbonfarmer,@VOD_English The continued obtuse denial syndrome. Unbelievable.   They have knowledge of the wholesale human trafficking and they just hold their tongues and eat their benefit.   Everyone knows.   What makes them believe anyone believes them? #corruption #cambodia,en,0,0,1,"['corruption', 'cambodia']"
1848,1550119584899874817,2022-07-21,10:04:43,1546622490788634624,sadimifuseeforu,sadi richards,"In Cambodia, the State Department said that ""endemic corruption"" has impeded efforts to help thousands including children trafficked to entertainment establishments, brick kilns and online scam operations.",en,1,0,0,"['corruption', 'cambodia']"
1849,1549958809220968448,2022-07-20,23:25:51,1149351043156701184,cambojanews,CamboJA News,"Cambodia is back on another U.S. blacklist. Washington, in its 2022 Trafficking in Persons report, downgraded the Kingdom to Tier 3 status, the lowest of three designations, citing endemic corruption and an unwillingness to hold human traffickers...  https://t.co/foAzTEq4Ai",en,0,1,1,"['corruption', 'cambodia']"
1850,1549937478655791104,2022-07-20,22:01:06,402618457,miketatarski,Michael Tatarski,"A new free-to-read Vietnam Weekly arrives tomorrow, covering how Vietnamese are being drawn into Cambodia's shocking scam operations, as well updates on a few major corruption cases. Sign up here:  https://t.co/knzjuARBbj",en,0,2,7,"['corruption', 'cambodia']"
1851,1549831514103304192,2022-07-20,15:00:02,90407341,southeastasiadc,CSIS Southeast Asia,"New #Cambodia report: “If GMA sanctions targeted at elites were going to achieve progress on human rights or corruption in Cambodia, success would have been apparent by now” write @GregPoling @charlesdunst and @simonhudes. Read here:  https://t.co/JwXjQ2iqZC",en,0,0,1,"['corruption', 'cambodia']"
1852,1549755380498055168,2022-07-20,09:57:30,440555505,channthaso,Channtha So,"U.S State Department said that ""endemic corruption"" has impeded efforts to help thousands including children trafficked to entertainment establishments, brick kilns and online scam operations in Cambodia.   https://t.co/9pgm5mzjXc",en,0,0,1,"['corruption', 'cambodia']"
1853,1549695963954122755,2022-07-20,06:01:24,2243152405,zachabuza,Zachary Abuza,"Between the covid-induced recession, corruption, &amp; a general lack of governmental concern, trafficking in persons worsened considerably in Southeast Asia in 2021. 3 countries, #Cambodia, #Indonesia, and #Vietnam saw their rankings fall. 4 of 10 are at the bottom of the rankings.  https://t.co/RkiRv8GcSk",en,0,2,7,"['corruption', 'cambodia']"
1854,1549522580490649600,2022-07-19,18:32:26,1417835697428439047,dante4_real,Dante4real4real,@GordonGChang China is building a 'Las Vegas' in Cambodia. Corruption at the highest level.,en,0,0,0,"['corruption', 'cambodia']"
1855,1549225406720770050,2022-07-18,22:51:34,744840375492214786,realfakeliberal,Primordial,@Mon4Kooyong Follow the money.  Do not allow Albanese to collude with Dutton to hobble ICAC with limits on the definition of corruption that protects those running one-off scams here and there. Morrison's $55m refugee deal with Cambodia must be examined. So too $30m Lepington Triangle deal.,en,0,5,8,"['corruption', 'cambodia']"
1856,1548936518810890242,2022-07-18,03:43:38,476953088,daniellerose84,Danielle K-O,Five years later the charges against two Cambodia Daily journalists who went after logging and corruption in the country was finally dropped.  https://t.co/ofp6fUYSKX,en,0,6,37,"['corruption', 'cambodia']"
1857,1548886355375116288,2022-07-18,00:24:18,1114577815234592770,finance_weights,Anup,"@Tim_Clif First glance points to the usual culprits like corruption, population, low income, etc. However I’ve been to lower income countries like Vietnam and Cambodia. People can sit on the footpath in Hanoi for dinner. I think it only boils down to civic sense which we Indians don’t have",en,0,1,4,"['corruption', 'cambodia']"
1858,1547964013459300352,2022-07-15,11:19:15,1492288624821473281,atx_irishman,Irishman_atx 🇮🇪🇺🇸🇨🇦 🍀🍊,@megaking14 Cambodia got tired of the voting corruption and began utilizing this method. 👍,en,1,0,1,"['corruption', 'cambodia']"
1859,1547834178871341058,2022-07-15,02:43:20,15075355,carbonfarmer,carbonfarmer,Just so you know how badly your indifference has contributed to criminal enterprise in Cambodia.. just read the news.   Well done! Another screw up.    https://t.co/piFxk90O6B   #lizztruss #fcdo #corruption #UNOCHA #Boris #kidnappedincambodia,en,0,0,0,"['corruption', 'cambodia']"
1860,1547538218689642498,2022-07-14,07:07:17,1952135178,cambodge_info,Cambodge Info,"Le trafic humain, l'esclavage moderne au #Cambodge, à #SihanoukVille entretenus par la corruption sans limite du gouvernement de HUN Sen.Un excellent reportage à regarder absolument. Bravo à Aljazeera. Forced to Scam: Cambodia’s Cyber Slaves  https://t.co/fEui597lC5 via @AJEnglish",fr,0,3,0,"['corruption', 'cambodia']"
1861,1546380085623926785,2022-07-11,02:25:17,1163608655893164032,hippogriffthe,The Hippogriff,"@brucehawker2010 Oh it is a ""government policy"" since the day we decided to become the Western version of Cambodia under Hun Sen!.  Hard to believe?. Just look at it, from Councils to Federal Gov outright &amp; borderline corruption/unethical behaviour is the norm.",en,0,0,1,"['corruption', 'cambodia']"
1862,1546294487160279040,2022-07-10,20:45:09,1518747654876176384,_bong_boran_,Bong Boran,"@Keck553 @JewThao72 His real name was Saloth Sar. To begin with he aimed to stop corruption and French oppression in Cambodia.  ""Pol pot"" is the name of a group of five ""brothers"", where one of them was ""Ta Mok"". It was Ta Mok and his connection to the French, which is responsible for the genocide.",en,0,0,1,"['corruption', 'cambodia']"
1863,1546149095844319232,2022-07-10,11:07:25,1514656044672327687,texsaez,Tex Saez,"@000crypto000 @JdUrbee @ThinkingAtheist There are plenty of examples of corruption and immorality in positions of unchecked power, both by atheists (Mao Zedong in China, Joseph Stalin in the USSR, and Pol Pot in Cambodia) and theists (Adolf Hitler in Germany, Francisco Franco in Spain, and Idi Amin in Uganda).",en,0,0,0,"['corruption', 'cambodia']"
1864,1545712484086329344,2022-07-09,06:12:28,1068947585245696001,annem67993158,🎯🎯🆘Anne M🆘⚖️⚖️,@ozcrimenews @andrewt392021 That is what I have read too. Without a doubt there has been a lot of money under the table. I haven't been to Cambodia for decades. It was a poor country and the number of landmine amputees was horrendous but the people were genuine yet official corruption was bad and the norm.,en,0,0,1,"['corruption', 'cambodia']"
1865,1545607828802781185,2022-07-08,23:16:37,1005252329606647808,bao_ez,Bao,"@LowrieJohn @MechDara1 @Cambodia The Chinese donations I mentioed are directed to schools, not to the government. There may be problems with efficiency and sustainability, but there is no problem with corruption. I believe they can do better if there is positive feedback.",en,2,0,3,"['corruption', 'cambodia']"
1866,1545299967778390016,2022-07-08,02:53:17,2267964218,curtisschin,🚶🏻Curtis S. Chin,Who you calling corrupt? #CPI2021 #Corruption in SE Asia—From perceived least to most corrupt:  5 #Singapore 🇸🇬 62 #Malaysia 🇲🇾 87 #Vietnam 🇻🇳 96 #Indonesia 🇮🇩 110 #Thailand 🇹🇭 117 #Philippines 🇵🇭 128 #Laos 🇱🇦 140 #Myanmar 🇲🇲 157 #Cambodia 🇰🇭 NA #Brunei 🇧🇳  https://t.co/9m986sOEKW  https://t.co/H4d4BZn2HP,en,0,0,1,"['corruption', 'cambodia']"
1867,1544918415936090112,2022-07-07,01:37:08,2989173842,buleysue,Sue Bules absolute prole,"@cloudycooper @SuDharmapala Vietnam, Thailand. China, Japan all recovered due to isolationism post  colonialism. Huge issues still in Cambodia and Laos due to mainly corruption on a larger scale than the aforementioned.",en,0,0,1,"['corruption', 'cambodia']"
1868,1544631650054975490,2022-07-06,06:37:37,1422148170188947458,svayken,Ken svay,After 20 years of Chinese influence we are at last facing The Reckoning. I lived in Cambodia for half of this period and learned to smell corruption. Whenever I returned briefly I thought Australia stunk. I was correct.,en,0,0,2,"['corruption', 'cambodia']"
1869,1542760270820409344,2022-07-01,02:41:26,123828557,johayeslibdem,Jo Hayes not a Dame #blacklivesmatter #FBPE,The determination - &amp; success! - of those who oppose authoritarianism &amp; corruption &amp; support liberalism &amp; democracy in #Cambodia are inspiring. #Candelightparty #LIat75,en,0,2,0,"['corruption', 'cambodia']"
1870,1542113096650657793,2022-06-29,07:49:47,2246226396,peterthart2,Peter T Hart😁🇨🇦,@WoodReporting It's hard to say anything other than this is willful ignorance and corruption. Nobody should wonder any more about 1933-45 or 1917 or Cambodia or ...,en,0,0,1,"['corruption', 'cambodia']"
1871,1541980911696314368,2022-06-28,23:04:32,884011184604594176,cambodia_expats,Cambodia Expats Online 🌐,Cambodia News: Ex-Corruption Cop Busted for Corruption by ACU   https://t.co/FUOlwP77vo  #Cambodia #Local #News  https://t.co/eF8l8P3hXM,en,0,0,2,"['corruption', 'cambodia']"
1872,1541770740856492033,2022-06-28,09:09:23,1386346904,rainsysam,Rainsy Sam,"""Quarante ans de terreur et de corruption."" #Cambodia   https://t.co/PJtm5RF3M8",fr,1,3,9,"['corruption', 'cambodia']"
1873,1541096634284662784,2022-06-26,12:30:44,2999043189,tsun7080,Thourn Sun,"@GeopoliticsMag @RainsySam Hun sen oppressed voting rights on June 5th 2022 ,on the local election in Cambodia,his  manipulated, and corruption,stealing people ballots and he always threatened his people everyday if they don't vote for him they are living in fear of being jail,kill or impossible to live",en,0,0,1,"['corruption', 'cambodia']"
1874,1541046571705712640,2022-06-26,09:11:48,1241012486108631040,amohangadeidre,Dee Colonised.,"@scrowder @Soulshi91863399 Grew up watching babies in ditches in Cambodia.. Yah, nothings changed there. Corruption leaves citizens as slaves to Billionaires while Millionaires play corporate politics. Fukn colonists!! Grab and destroy without question.",en,0,1,1,"['corruption', 'cambodia']"
1875,1540802013881065472,2022-06-25,17:00:01,90407341,southeastasiadc,CSIS Southeast Asia,"New #Cambodia report: “If GMA sanctions targeted at elites were going to achieve progress on human rights or corruption in Cambodia, success would have been apparent by now” write @GregPoling @charlesdunst and @simonhudes. Read here:  https://t.co/JwXjQ20Q84",en,0,1,3,"['corruption', 'cambodia']"
1876,1540211524903481345,2022-06-24,01:53:37,952692558840307712,shit_i_need,shit i tell myself,Om Yentieng is the head of Cambodia's anti-corruption unit.  https://t.co/x1mcigbf9N,en,0,0,0,"['corruption', 'cambodia']"
1877,1540207878551883777,2022-06-24,01:39:08,479297376,lowriejohn,𝐉𝐨𝐡𝐧 𝐋𝐨𝐰𝐫𝐢𝐞,"@SangieC @sstrangio #Cambodia - As it is with much crime and daily corruption. Ruling party's much vaunted network right down to sub-village levels means nothing goes unnoticed, with proceeds percolating up. Authorities are part of both solution and problem. @FutureForumAsia  https://t.co/OD7DljWbIm",en,0,0,1,"['corruption', 'cambodia']"
1878,1539915220839444480,2022-06-23,06:16:13,57524926,sortius,sortius,"People's reactions to the Guide Dogs Vic revelations show so many know so little about charities. GDV is the norm, very few charities avoid large scale corruption. When growing up in Cambodia I saw it first hand, with charities decking out staff with expensive cars and homes",en,3,3,7,"['corruption', 'cambodia']"
1879,1539814099529666561,2022-06-22,23:34:24,2267964218,curtisschin,🚶🏻Curtis S. Chin,Who you calling corrupt? #CPI2021 #Corruption in SE Asia—From perceived least to most corrupt:  5 #Singapore 🇸🇬 62 #Malaysia 🇲🇾 87 #Vietnam 🇻🇳 96 #Indonesia 🇮🇩 110 #Thailand 🇹🇭 117 #Philippines 🇵🇭 128 #Laos 🇱🇦 140 #Myanmar 🇲🇲 157 #Cambodia 🇰🇭 NA #Brunei 🇧🇳  https://t.co/9m986sOEKW  https://t.co/uq4Zrex0cK,en,0,1,2,"['corruption', 'cambodia']"
1880,1539204768853200898,2022-06-21,07:13:08,15182798,thejoshuablog,joshua epstein🏳️‍🌈🖖🏼🗽👨🏼‍💻🇺🇸,Via @RawStory: 'World's biggest' freshwater fish netted in Cambodia  https://t.co/oV87u9QuGM | #politics #trump #corruption,en,0,3,0,"['corruption', 'cambodia']"
1881,1539185169738780673,2022-06-21,05:55:15,17183476,photo_journ,John Le Fevre 🇦🇺 😷 🇹🇭🇰🇭,#LandOfSlaves #Chinesemafia #corruption #Cambodia,qht,0,0,2,"['corruption', 'cambodia']"
1882,1538944460159176705,2022-06-20,13:58:46,1043999901095464960,vallieres_david,David Vallieres,"@frankoz95967943 @coloradotravis Cambodia, absolutely beautiful and seemingly peaceful, a cesspool of corruption and now annexed sans military conflict by Guangdong",en,1,0,2,"['corruption', 'cambodia']"
1883,1538108222191587329,2022-06-18,06:35:51,1031122302963015680,jeff77400952,❌Jeff❌,"@StandUp4Peace22 @Apipwhisperer1 @MatthewJshow @nytimes That's the Europe &amp; US that bombed Iraq, Serbia, Yemen, Libya, Vietnam, Cambodia, Syria etc. Destroying germ warfare labs on your doorstep is not imperialism. Hundreds of US bases around the world that you ignore. Your corruption and degradation of the word peace is disgusting",en,1,1,0,"['corruption', 'cambodia']"
1884,1537828203561201664,2022-06-17,12:03:09,711908946,sochua_mu,MuSochua,"#SonChhay gained respect for fight against #corruption inside National Assembly.  This material is distributed by Sochua Mu on behalf of the Cambodia National Rescue Party.  Additional information is available at the Department of Justice, Washington, DC.",en,0,0,6,"['corruption', 'cambodia']"
1885,1537044705678020608,2022-06-15,08:09:49,954297033086480387,apb_52,Andrew​ B,"@manmader ""Cambodia’s judicial system has been accused of being corrupt and frequently following the ruling party’s demands"" 😌 @cambojanews @unhrcpr #corruption #greed.  https://t.co/cVv24DWcU8",en,0,0,0,"['corruption', 'cambodia']"
1886,1536986778548183041,2022-06-15,04:19:38,429939185,luciopicci,Lucio Picci,"The pacification of Cambodia was made possible by (internationally sponsored) corruption, which allowed for a minimum of consensus to materialize. It has been a very complicated path.",en,0,0,0,"['corruption', 'cambodia']"
1887,1536685182597664772,2022-06-14,08:21:12,1396165255387025411,miajanewest77,Mia Weston,@OJS50 @JKash000 The Ukrainians aren't spending money on the carpet bombing of Laos &amp; Cambodia&amp; won't have anything like the same number of troops in theatre so burning through that kind of money looks very odd. And then there is the known corruption in Ukraine...,en,0,0,0,"['corruption', 'cambodia']"
1888,1536284925581791232,2022-06-13,05:50:43,2411113435,jennylanderson_,Jennifer Anderson,A Radio Free Asia investigation into the naturalized Chinese tycoon reveals a lot about the nature of corruption in Cambodia – and at the global level. @CIPE_ACGC   https://t.co/Xkx7lS4uOa,en,0,0,1,"['corruption', 'cambodia']"
1889,1535881721840812032,2022-06-12,03:08:32,3224298379,proudtobeuslaos,Proud To Be Us Laos,"Many thanks to @JohnHydePerth &amp; @annika_wythes of @UNODC_SEAP🇺🇳 for your kind invitation to the CSO and Media Workshop on Methods and Tools for Anti-Corruption Engagement, 7-9 June 2022 at Siem Reap, Cambodia 🇰🇭 🇱🇦🌈🏳️‍⚧️🙏💐  Cc: @UNODC,@UNinLaoPDR  https://t.co/JLdrWsQAnK",en,0,2,7,"['corruption', 'cambodia']"
1890,1535818376324710400,2022-06-11,22:56:49,747556194621886468,davids1947,DavidS1947,"BBC has done a programme on stolen artefacts featuring Cambodia. The government has written to Britain requesting assistance, the reporter asks the Minister of Culture why Britain should assist a country with serious corruption and poor human rights record? Ehm!  🙄",en,1,1,7,"['corruption', 'cambodia']"
1891,1535599743291760640,2022-06-11,08:28:03,149993196,greg0706,Greg Christie,KT | Cambodia tycoon and a former Deputy Governor both jailed for 7 years on corruption and bribery charges.  https://t.co/m9mgU2Dfbm,en,0,0,0,"['corruption', 'cambodia']"
1892,1535486195295490050,2022-06-11,00:56:51,1349196356976484354,telesoritas,Telesoritas,"Cambodia's Culture Minster, Phoeurng Sackona, says Cambodia will take its own corruption seriously when no other country in the world is corrupt.  That's an impressive red herring! Fuck you, Sackona.  @BBCWorld",en,0,0,0,"['corruption', 'cambodia']"
1893,1535396977663279105,2022-06-10,19:02:20,172616147,sjrose99,Sandra Barr - Nonfiction Lover,"@AliVelshi I watched Nixon hearings every night. I was 27, a Vietnam era vet. Shocked by Watergate, Pentagon Papers, Cambodia bombings, dead US soldiers, my generation. I will never forgive Nixon. Corruption is corruption. Watch, learn about history #Jan6thHearings. @JohnWDean #WomenMarines",en,0,0,1,"['corruption', 'cambodia']"
1894,1535332948656160768,2022-06-10,14:47:54,1422148170188947458,svayken,Ken svay,"Australia gives resource companies stability and a rule of law. In return we ask for royalties and taxes. If they don’t like it they can go to the third world and experience coups, rabid corruption, extortion, murder and few profits and zero certainty. BHP left Cambodia in a week",en,0,0,0,"['corruption', 'cambodia']"
1895,1534914994265018372,2022-06-09,11:07:06,1271489370516832258,amandal10442115,Amanda Lee,#newsupdate Four elected commune leaders from the Candlelight Party are committed to serving the people and fighting corruption Read the news #Cambodia from Ponleak  by visiting the link  https://t.co/MaIggPZgxY.   #newsnight #newsalert #newsupdates #newszero #newshot,en,0,0,0,"['corruption', 'cambodia']"
1896,1534914343980376069,2022-06-09,11:04:31,1503011155027308548,latestasianews,RAJACREATOR - Latest Asia News Today,#newsupdate Four elected commune leaders from the Candlelight Party are committed to serving the people and fighting corruption Read the news #Cambodia from Ponleak  by visiting the link  https://t.co/FPC8WcfWWN.   #newsnight #newsalert #newsupdates #newszero #newshot,en,0,0,0,"['corruption', 'cambodia']"
1897,1534893217925062656,2022-06-09,09:40:34,1362289216034459652,minhng57582066,Minh Ng,"I reverse the meaning of all those honour titles. Kissinger received a Nobel peace prize - he was labelled the butcher of Cambodia, bombing everything that moves. This is the sign of a structural moral corruption.",en,0,0,2,"['corruption', 'cambodia']"
1898,1534734368308342784,2022-06-08,23:09:22,37175888,johnhydeperth,John Hyde,"Boosting Our Oversight - ASEAN CSOs &amp; Media @ Siem Reap, Cambodia 🇰🇭 w @UNODC_SEAP devising heightened anti-corruption engagement w #Parliaments  inputs @Proudtobeuslaos Jai Vongvilai, Bu Nhi, Carmela @PCIJdotOrg @LaodeMSyarif Vu Ngoc Hoa @ticambodia Camboja @tempodotco Yandrie  https://t.co/01py1xmWr8",en,0,11,18,"['corruption', 'cambodia']"
1899,1534703053483282432,2022-06-08,21:04:56,2350942002,arthuristheboy,John Hawkins,@LowrieJohn @PreyLangNetwork @ProtectPreyLang @jackoozell Here's an idea. Why don't all foreign governments demand tangible evidence that Cambodia - and many other countries like it - is really tackling nationwide corruption in all areas before throwing billions of dollars in 'aid' into the country?  Or am I missing something? 🤔🙄,en,1,0,0,"['corruption', 'cambodia']"
1900,1533954716534722561,2022-06-06,19:31:18,347568180,voastevenson,Jim Stevenson,A Radio Free Asia investigation into the naturalized Chinese tycoon Wang Yaohui reveals a lot about the nature of corruption in Cambodia - and at the global level.  https://t.co/NFSojPr9Ey  @diplomat_apac,en,0,0,0,"['corruption', 'cambodia']"
1901,1533580687307067392,2022-06-05,18:45:03,39922594,diplomat_apac,The Diplomat,A Radio Free Asia investigation into the naturalized Chinese tycoon Wang Yaohui reveals a lot about the nature of corruption in #Cambodia – and at the global level.  https://t.co/T6WLdBoZpQ  https://t.co/ZYbte9sfSi,en,0,1,6,"['corruption', 'cambodia']"
1902,1533573844325126144,2022-06-05,18:17:51,15805376,phnompenhbifun,PhnomPenh for fun,"@Molson_Hart 2 many problems doing business in #India. 2 much government interference. 2 much drama with money movement. 2 much corruption at locals levels. 2 much mob rule mentality. 2 much religion. 2 many holidays. Best Vietnam or Thailand. Then Malaysia, Indonesia, Philippines, Cambodia",en,0,0,0,"['corruption', 'cambodia']"
1903,1533477937227386880,2022-06-05,11:56:45,711908946,sochua_mu,MuSochua,"@ouritthy opposition as chief: no illegal logging, land grabbing,corruption.   This material is distributed by Sochua Mu on behalf of the Cambodia National Rescue Party.  Additional information is available at the Department of Justice, Washington, DC.",en,0,0,0,"['corruption', 'cambodia']"
1904,1533252375179304961,2022-06-04,21:00:27,39922594,diplomat_apac,The Diplomat,A Radio Free Asia investigation into the naturalized Chinese tycoon Wang Yaohui reveals a lot about the nature of corruption in Cambodia – and at the global level.  https://t.co/T6WLdBoZpQ  https://t.co/Ott4V7JGGI,en,0,2,4,"['corruption', 'cambodia']"
1905,1533116835398156288,2022-06-04,12:01:52,1529486533387902977,duckofliberty,TR,"If any politician ever says you “don’t need ____.” You 100% need it  Nazi Germany Cuba China Cambodia  Venezuela  The USSR Just a few of the countries ran by corruption, drugs, and government issued body bags what do they all have in common they said you don’t need guns.",en,0,0,0,"['corruption', 'cambodia']"
1906,1532936693816471552,2022-06-04,00:06:03,39922594,diplomat_apac,The Diplomat,A Radio Free Asia investigation into the naturalized Chinese tycoon Wang Yaohui reveals a lot about the nature of corruption in Cambodia – and at the global level.  https://t.co/T6WLdBoZpQ  https://t.co/lhHr4bNNge,en,1,6,8,"['corruption', 'cambodia']"
1907,1532638461450395648,2022-06-03,04:20:58,2608779276,geoff_p_wade,Geoff Wade,Cambodia： English Football League to Probe Alleged Cambodian Ownership Connection: A Radio Free Asia investigation into the naturalized Chinese tycoon Wang Yaohui 王耀辉 reveals a lot about the nature of corruption in Cambodia – and at the global level  https://t.co/Hu4ssbzwAL,en,1,4,3,"['corruption', 'cambodia']"
1908,1532631684717367297,2022-06-03,03:54:03,39922594,diplomat_apac,The Diplomat,A Radio Free Asia investigation into the naturalized Chinese tycoon Wang Yaohui reveals a lot about the nature of corruption in Cambodia – and at the global level.  https://t.co/T6WLdBoZpQ  https://t.co/oM1InnOs3a,en,1,8,12,"['corruption', 'cambodia']"
1909,1532169554016624640,2022-06-01,21:17:42,1160254302868275200,lhsingapura,lhsingapura,"I note that IPEF includes many in ASEAN but excludes Myanmar, Laos &amp; Cambodia.  This framework by Biden has 4 pillars: • Connected economy; • Supply chain resilience &amp; infrastructure; • Clean energy &amp; decarbonization; • Fairness in taxes &amp; anti-corruption.  https://t.co/ersPqYUcK4",en,1,0,0,"['corruption', 'cambodia']"
1910,1532067518482743296,2022-06-01,14:32:15,1393661656945741825,tesla420069,John,"@TeslaAndDoge So much money goes into corruption. They don't have time to do good deeds. Same thing goes for Cambodia, Vietnam, etc.",en,2,0,1,"['corruption', 'cambodia']"
1911,1531828697048948738,2022-05-31,22:43:16,1319118835752955904,sallieparkapac,Sallie Park,"June Prayer Focus: Cambodia  Though Cambodia has made economic progress in recent years, it remains one of the poorest countries in the world. Poverty, drug addiction, human trafficking, widespread corruption, and exploitation of children and youth overshadow the smiles...1/  https://t.co/HS3RhkoKvI",en,1,2,4,"['corruption', 'cambodia']"
